,section,byline,title,abstract,class,print_page,pub_date,type_of_material,class_le,byline_le,section_le,type_of_material_le,title_clean,abstract_clean,title_vec_avg,abstract_vec_avg,title_len,abstract_len,capital_letters,title_punct_num,abstract_punct_num,title_!,abstract_!,title_?,abstract_?,authors_num,coauthors,sections_grouped,title_ner,title_ner_type,ners_num,ner_GPE,ner_PERSON,ner_ORG,ner_MONEY,ner_NORP,pub_day_of_week,title_sentiment,abstract_sentiment,countries
3229,Business Day,Jeanna Smialek,"The Fed Bets on a ‘Soft Landing,’ but Recession Risk Looms","Central bankers have been clear that they will do what it takes to control inflation. They are betting on a soft landing, but a bumpy one is possible.",all,1.0,2022-03-25 15:37:17+00:00,News,0,333.0,4.0,2.0,"fed bets ‘soft landing,’ recession risk looms","central bankers clear takes control inflation. betting soft landing, bumpy one possible.",-0.013248804,-0.008709044,11,28,8,1,3,0,0,0,0,1,0,4,['The Fed Bets'],['ORG'],1,0.0,0.0,1.0,0.0,0.0,4.0,-0.8047,0.2023,[]
3226,Opinion,Jesse Wegman,Ginni and Clarence Thomas Have Done Enough Damage,Trump couldn’t ask for two better friends in his quest to harm American democracy. ,all,18.0,2022-03-25 15:26:45+00:00,Op-Ed,0,348.0,15.0,5.0,ginni clarence thomas done enough damage,trump couldn’t ask two better friends quest harm american democracy.,-0.008783889,-0.0014106055,8,14,7,0,1,0,0,0,0,1,0,7,"['Ginni', 'Clarence Thomas']","['ORG', 'PERSON']",2,0.0,0.0,1.0,0.0,0.0,4.0,-0.4939,0.3612,[]
2113,World,Steven Erlanger,Putin’s War on Ukraine Is About Ethnicity and Empire,"Biden’s framework of ‘democracies versus autocracies’ misses the darker source of this war, which has deep roots in Russian history and thought.",all,9.0,2022-03-16 11:29:57+00:00,News,0,680.0,30.0,2.0,putin’s war ukraine ethnicity empire,"biden’s framework ‘democracies versus autocracies’ misses darker source war, deep roots russian history thought.",0.007497686,-0.004560029,9,22,7,0,2,0,0,0,0,1,0,5,"['Putin', 'Ukraine', 'Empire']","['PERSON', 'GPE', 'GPE']",3,0.0,1.0,0.0,0.0,0.0,2.0,-0.5994,-0.7597,"['Ukraine', 'Empire']"
2645,Science,Robin George Andrews,How a Tiny Asteroid Strike May Save Earthlings From City-Killing Space Rocks,"An asteroid hunter detected the small object two hours before it crashed into the sea near Greenland, a sign of the growing sophistication of NASA’s planetary defense system.",all,3.0,2022-03-21 16:22:10+00:00,News,0,618.0,19.0,2.0,tiny asteroid strike may save earthlings city-killing space rocks,"asteroid hunter detected small object two hours crashed sea near greenland, sign growing sophistication nasa’s planetary defense system.",-0.0016390189,0.0031402516,12,28,12,1,2,0,0,0,0,1,0,3,[],[],0,0.0,0.0,0.0,0.0,0.0,0.0,0.4019,0.296,[]
558,The Learning Network,The Learning Network,Word of the Day: de rigueur,This term has appeared in 39 articles on NYTimes.com in the past year. Can you use it in a sentence?,all,0.0,2022-03-03 07:00:02+00:00,News,0,695.0,24.0,2.0,word day: de rigueur,term appeared 39 articles nytimes.com past year. use sentence?,-0.015869731,-0.001931308,6,20,2,1,3,0,0,0,1,1,0,7,[],[],0,0.0,0.0,0.0,0.0,0.0,3.0,0.0,0.0772,[]
714,U.S.,Patricia Mazzei and Alexandra Glorioso,Florida Lawmakers Vote to Ban Abortions After 15 Weeks,The legislation is modeled after an abortion law in Mississippi that the Supreme Court appears poised to uphold in a ruling expected this summer.,all,17.0,2022-03-04 02:58:49+00:00,News,0,588.0,28.0,2.0,florida lawmakers vote ban abortions 15 weeks,legislation modeled abortion law mississippi supreme court appears poised uphold ruling expected summer.,0.007421794,0.00468449,9,24,7,0,1,0,0,0,0,1,0,6,"['Florida Lawmakers Vote to Ban Abortions', '15 Weeks']","['ORG', 'DATE']",2,0.0,0.0,1.0,0.0,0.0,4.0,-0.5574,0.6808,[]
2692,New York,Luis Ferré-Sadurní,N.Y. officials don’t expect a new Omicron surge but stressed they will remain vigilant.,"As BA.2 drives increased caseloads in some parts of Europe, New York officials don’t anticipate a “steep surge” but are watching the data closely.",all,0.0,2022-03-21 22:17:47+00:00,News,0,451.0,13.0,2.0,n.y. officials don’t expect new omicron surge stressed remain vigilant.,"ba.2 drives increased caseloads parts europe, new york officials don’t anticipate “steep surge” watching data closely.",-0.013123376,-0.006078899,14,24,3,3,3,0,0,0,0,1,0,6,"['N.Y.', 'Omicron']","['GPE', 'ORG']",2,1.0,0.0,0.0,0.0,0.0,0.0,-0.2617,0.1406,['N.Y.']
2315,Theater,Elisabeth Vincentelli,‘The Life’ Review: Turning More Than a Few New Tricks,Billy Porter brings a heavy-handed touch as the director and adapter of this 1997 musical about prostitutes and pimps in Manhattan’s bad old days.,all,3.0,2022-03-17 19:59:44+00:00,Review,0,223.0,25.0,6.0,‘the life’ review: turning new tricks,billy porter brings heavy-handed touch director adapter 1997 musical prostitutes pimps manhattan’s bad old days.,-0.0034675829,-0.006373125,10,24,9,1,2,0,0,0,0,1,0,1,['The Life’ Review: Turning More Than a Few New Tricks'],['WORK_OF_ART'],1,0.0,0.0,0.0,0.0,0.0,3.0,-0.128,-0.5423,[]
2549,Real Estate,C. J. Hughes,"Homes That Sold for Around $625,000",Recent residential sales in New York City and the region.,all,0.0,2022-03-20 09:00:09+00:00,News,0,114.0,18.0,2.0,"homes sold around $625,000",recent residential sales new york city region.,0.010527239,0.004874318,6,10,4,2,1,0,0,0,0,1,0,4,"['625,000']",['MONEY'],1,0.0,0.0,0.0,1.0,0.0,6.0,0.0,0.0,[]
1755,Real Estate,C. J. Hughes,"Homes That Sold for Around $775,000",Recent residential sales in New York City and the region.,all,8.0,2022-03-13 09:00:07+00:00,News,0,114.0,18.0,2.0,"homes sold around $775,000",recent residential sales new york city region.,0.010527239,0.004874318,6,10,4,2,1,0,0,0,0,1,0,4,"['775,000']",['MONEY'],1,0.0,0.0,0.0,1.0,0.0,6.0,0.0,0.0,[]
932,Sports,Talya Minsberg,Q. & A.: How to Deal With Running Injuries,"How can you avoid overuse injuries? Can you run through upper body pain? What kind of cross-training is the most efficient? Your injury questions, answered.",all,2.0,2022-03-06 10:00:07+00:00,News,0,687.0,20.0,2.0,q. & a.: deal running injuries,"avoid overuse injuries? run upper body pain? kind cross-training efficient? injury questions, answered.",-0.0076938644,-0.006597451,9,25,7,4,6,0,0,0,3,1,0,1,['Q. & A.'],['ORG'],1,0.0,0.0,1.0,0.0,0.0,6.0,0.0,-0.7193,[]
848,Briefing,Jonathan Wolfe,The Great School Unmasking,More states are lifting school mask requirements.,all,2.0,2022-03-04 22:49:45+00:00,News,0,378.0,2.0,2.0,great school unmasking,states lifting school mask requirements.,0.00067465106,0.0059642154,4,7,4,0,1,0,0,0,0,1,0,4,['The Great School Unmasking'],['ORG'],1,0.0,0.0,1.0,0.0,0.0,4.0,0.6249,0.0,[]
1236,U.S.,Reid J. Epstein,Mark Meadows Spread Trump’s Voter Fraud Claims. Now His Voting Record Is Under Scrutiny.,The former Trump aide listed a mobile home in rural North Carolina as his residence at the same time that he was running operations at the White House.,all,15.0,2022-03-09 00:49:53+00:00,News,0,608.0,28.0,2.0,mark meadows spread trump’s voter fraud claims. voting record scrutiny.,former trump aide listed mobile home rural north carolina residence time running operations white house.,-0.0032853708,-0.0029995993,14,28,14,2,1,0,0,0,0,1,0,6,['Mark Meadows Spread Trump’s Voter Fraud Claims'],['PERSON'],1,0.0,1.0,0.0,0.0,0.0,2.0,-0.5859,0.0,[]
3626,Sports,William McDonald,"Joan Joyce, a Sensation in Softball and More, Is Dead at 81","Her pitching feats — including striking out Ted Williams — were legend. And her prowess in basketball, volleyball and golf as well spoke to her all-around athletic greatness.",all,10.0,2022-03-29 20:41:51+00:00,Obituary (Obit),0,736.0,20.0,4.0,"joan joyce, sensation softball more, dead 81","pitching feats — including striking ted williams — legend. prowess basketball, volleyball golf well spoke all-around athletic greatness.",-0.01116817,-0.014886901,12,28,7,2,4,0,0,0,0,1,0,1,"['Joan Joyce', '81']","['PERSON', 'CARDINAL']",2,0.0,1.0,0.0,0.0,0.0,1.0,-0.6786,0.2732,[]
3583,Business Day,Katie Robertson,Condé Nast workers form a companywide union.,"The union will cover more than 500 employees from all of Condé Nast’s brands, except the four publications that have already unionized.",all,4.0,2022-03-29 14:37:33+00:00,News,0,406.0,4.0,2.0,condé nast workers form companywide union.,"union cover 500 employees condé nast’s brands, except four publications already unionized.",-0.0031675184,-0.0041553015,7,22,2,1,2,0,0,0,0,1,0,4,['Condé Nast'],['ORG'],1,0.0,0.0,1.0,0.0,0.0,1.0,0.0,0.0,[]
2542,U.S.,Carl Hulse,"On Eve of Confirmation Hearings, G.O.P. Steps Up Attacks on Jackson","The White House and Democrats have pushed back hard against new claims that the judge was overly lenient in certain cases, calling them a smear.",all,25.0,2022-03-20 07:00:11+00:00,News,0,120.0,28.0,2.0,"eve confirmation hearings, g.o.p. steps attacks jackson","white house democrats pushed back hard new claims judge overly lenient certain cases, calling smear.",-0.010440292,-0.009184772,11,25,11,4,2,0,0,0,0,1,0,6,"['G.O.P.', 'Jackson']","['ORG', 'PERSON']",2,0.0,0.0,1.0,0.0,0.0,6.0,-0.4404,0.0772,[]
3157,Books,Padma Venkatraman,Karina Yan Glaser’s First Non-Vanderbeekers Novel,“A Duet for Home” interweaves the story lines of two music-loving preteens living in a South Bronx homeless shelter.,all,22.0,2022-03-25 06:36:37+00:00,Review,0,583.0,1.0,6.0,karina yan glaser’s first non-vanderbeekers novel,“a duet home” interweaves story lines two music-loving preteens living south bronx homeless shelter.,-0.010100383,-0.011430455,6,19,7,1,2,0,0,0,0,1,0,1,"['Karina Yan Glaser’s', 'First Non-Vanderbeekers Novel']","['PERSON', 'ORG']",2,0.0,1.0,0.0,0.0,0.0,4.0,0.3182,0.0,[]
423,Travel,Nina Burleigh,Billionaires Clash Over the Future in a Caribbean Eden,A legal feud over a hotel in St. Barts pits development against fragile nature on this tropical Arcadia for the ultrarich. It might also signal a turning point in the hyper-development of the island.,all,6.0,2022-03-02 10:00:26+00:00,News,0,576.0,27.0,2.0,billionaires clash future caribbean eden,legal feud hotel st. barts pits development fragile nature tropical arcadia ultrarich. might also signal turning point hyper-development island.,-0.0005164917,-0.0054510436,9,34,6,0,4,0,0,0,0,1,0,2,['Caribbean'],['NORP'],1,0.0,0.0,0.0,0.0,1.0,2.0,0.0,-0.2263,[]
3258,Opinion,John McWhorter,"‘BIPOC’ Is Jargon. That’s OK, and Normal People Don’t Have to Say It.",Vocabulary imposed from on high sometimes just can’t catch on.,all,0.0,2022-03-25 20:00:48+00:00,Op-Ed,0,362.0,15.0,5.0,"‘bipoc’ jargon. that’s ok, normal people don’t say it.",vocabulary imposed high sometimes can’t catch on.,-0.014978719,-0.0057230084,13,10,16,3,1,0,0,0,0,1,0,7,['Jargon'],['ORG'],1,0.0,0.0,1.0,0.0,0.0,4.0,0.0,-0.0772,[]
3001,U.S.,David D. Kirkpatrick and Stuart A. Thompson,QAnon Cheers Republican Attacks on Jackson. Democrats See a Signal.,Criticism of Judge Ketanji Brown Jackson’s sentencing decisions emerged as a theme among Republicans — and renewed debate about the party’s stance toward QAnon.,all,16.0,2022-03-24 07:00:11+00:00,News,0,187.0,28.0,2.0,qanon cheers republican attacks jackson. democrats see signal.,criticism judge ketanji brown jackson’s sentencing decisions emerged theme among republicans — renewed debate party’s stance toward qanon.,-0.010972042,-0.008646188,10,24,9,2,1,0,0,0,0,1,0,6,"['QAnon Cheers Republican Attacks', 'Jackson', 'Democrats']","['ORG', 'GPE', 'NORP']",3,0.0,0.0,1.0,0.0,0.0,3.0,0.0516,-0.5423,['Jackson']
3765,Health,Pam Belluck,"New A.L.S. Treatment Lacks Evidence of Benefit, F.D.A. Panel Finds","With a 6-4 vote, the group of independent advisers to the agency narrowly concluded that results from another clinical trial are needed to assess whether the therapy, called AMX0035, can help patients.",all,19.0,2022-03-30 21:12:49+00:00,News,0,584.0,10.0,2.0,"new a.l.s. treatment lacks evidence benefit, f.d.a. panel finds","6-4 vote, group independent advisers agency narrowly concluded results another clinical trial needed assess whether therapy, called amx0035, help patients.",-0.0066538746,0.0011144371,10,32,13,7,5,0,0,0,0,1,0,2,[],[],0,0.0,0.0,0.0,0.0,0.0,2.0,0.4588,0.4019,[]
3147,Style,Mary Pembleton,The First (and Last) Time She Didn’t Come Home,My sister and I searched for clues in our mother’s desk — and in her life — for why she left us and this world.,all,6.0,2022-03-25 04:00:08+00:00,News,0,499.0,21.0,2.0,first (and last) time didn’t come home,sister searched clues mother’s desk — life — left us world.,-0.006709588,-0.01680513,9,25,8,2,1,0,0,0,0,1,0,2,['First'],['ORDINAL'],1,0.0,0.0,0.0,0.0,0.0,4.0,0.0,0.0,[]
2819,U.S.,"Nick Corasaniti, Blake Hounshell and Leah Askarinam",A Republican Fights Voter Fraud in His Race (231 Days Before Election Day),"In an audio recording obtained by The New York Times, Adam Laxalt, a Republican running for Senate in Nevada, said he’s already gearing up to fight election fraud.",all,0.0,2022-03-22 23:01:58+00:00,News,0,569.0,28.0,2.0,republican fights voter fraud race (231 days election day),"audio recording obtained new york times, adam laxalt, republican running senate nevada, said he’s already gearing fight election fraud.",0.017163288,-0.0072655724,13,28,11,2,4,0,0,0,0,2,1,6,"['Republican', '231 Days', 'Election Day']","['NORP', 'DATE', 'DATE']",3,0.0,0.0,0.0,0.0,1.0,1.0,-0.7579,-0.7506,[]
1635,U.S.,Thomas Fuller,San Francisco Mayor Replaces Ousted School Board Members,"The new members announced on Friday, three weeks after a recall election created three vacancies, are women from diverse backgrounds.",all,17.0,2022-03-11 19:37:46+00:00,News,0,699.0,28.0,2.0,san francisco mayor replaces ousted school board members,"new members announced friday, three weeks recall election created three vacancies, women diverse backgrounds.",0.0032126082,0.00869777,8,20,8,0,3,0,0,0,0,1,0,6,"['San Francisco', 'Replaces Ousted School Board']","['GPE', 'ORG']",2,1.0,0.0,0.0,0.0,0.0,4.0,0.0,0.25,['San Francisco']
1782,Opinion,Tish Harrison Warren,How Readers Around the World Are Praying for Ukraine,"“The worst is yet to come, Lord, if you do not stop it.”",all,0.0,2022-03-13 15:15:04+00:00,Op-Ed,0,710.0,15.0,5.0,readers around world praying ukraine,"“the worst yet come, lord, stop it.”",-0.01865624,-0.01852306,9,13,7,0,3,0,0,0,0,1,0,7,['Ukraine'],['GPE'],1,1.0,0.0,0.0,0.0,0.0,6.0,0.3612,-0.4959,['Ukraine']
2319,Technology,Kellen Browning,Gig Workers Say High Gas Prices May Be a Breaking Point,Some drivers say they find it hard to justify spending hours on the road for Uber or Lyft as fuel costs continue to tick upward.,all,1.0,2022-03-17 20:31:50+00:00,News,0,412.0,23.0,2.0,gig workers say high gas prices may breaking point,drivers say find hard justify spending hours road uber lyft fuel costs continue tick upward.,-0.0042858785,0.0050556003,11,25,10,0,1,0,0,0,0,1,0,3,[],[],0,0.0,0.0,0.0,0.0,0.0,3.0,0.0,-0.1027,[]
885,World,Carlotta Gall,"In Ukraine’s West, Lviv Makes Itself a Vital Rear Base","Spared direct attacks so far, the city has become a transit point for thousands of fleeing refugees and for men and supplies headed to the front lines.",all,13.0,2022-03-05 10:00:22+00:00,News,0,123.0,30.0,2.0,"ukraine’s west, lviv makes vital rear base","spared direct attacks far, city become transit point thousands fleeing refugees men supplies headed front lines.",-0.0015225804,-0.0078641595,10,27,9,1,2,0,0,0,0,1,0,5,['Ukraine'],['GPE'],1,1.0,0.0,0.0,0.0,0.0,5.0,0.296,-0.4404,['Ukraine']
3375,Arts,Zachary Woolfe,Putin Says Tchaikovsky Is Being Canceled. The Met Opera Disagrees.,The company’s revival of “Eugene Onegin” gives the lie to the Russian president’s claim that his country’s composers are suffering in the West.,all,6.0,2022-03-27 15:25:31+00:00,Review,0,740.0,0.0,6.0,putin says tchaikovsky canceled. met opera disagrees.,company’s revival “eugene onegin” gives lie russian president’s claim country’s composers suffering west.,-0.010587245,-0.012687997,10,23,10,2,1,0,0,0,0,1,0,1,"['Putin', 'Tchaikovsky']","['PERSON', 'PERSON']",2,0.0,1.0,0.0,0.0,0.0,6.0,-0.3182,-0.4767,[]
3199,Business Day,"Andrew Ross Sorkin, Jason Karaian, Stephen Gandel, Michael J. de la Merced, Lauren Hirsch and Ephrat Livni",A Big Swing at Big Tech,One of the world’s most far-reaching laws to rein in the power of tech companies takes shape.,all,0.0,2022-03-25 11:43:23+00:00,News,0,61.0,4.0,2.0,big swing big tech,one world’s far-reaching laws rein power tech companies takes shape.,0.007977954,-0.00031123796,6,17,5,0,2,0,0,0,0,5,1,4,['Big Tech'],['ORG'],1,0.0,0.0,1.0,0.0,0.0,4.0,0.0,0.0,[]
376,U.S.,Vivek Shankar and Christine Chung,"Michigan, Illinois and parts of Hawaii join the list of places that are easing virus restrictions.",The moves come as the country’s Omicron wave recedes and after the Centers for Disease Control and Prevention updated its mask guidance.,all,0.0,2022-03-02 00:11:09+00:00,News,0,730.0,28.0,2.0,"michigan, illinois parts hawaii join list places easing virus restrictions.",moves come country’s omicron wave recedes centers disease control prevention updated mask guidance.,-0.0016988266,-0.0067862687,16,22,3,2,1,0,0,0,0,1,0,6,"['Michigan', 'Illinois', 'Hawaii']","['GPE', 'GPE', 'GPE']",3,1.0,0.0,0.0,0.0,0.0,2.0,0.4939,0.0,"['Michigan', 'Illinois', 'Hawaii']"
2357,World,Damien Cave,"Kids, Covid Isolation and Learning to Endure","The virus found us, and we’re doing just fine. I think.",all,0.0,2022-03-18 02:12:10+00:00,News,0,172.0,30.0,2.0,"kids, covid isolation learning endure","virus found us, we’re fine. think.",-0.0013828228,-0.005012985,7,11,5,1,3,0,0,0,0,1,0,5,[],[],0,0.0,0.0,0.0,0.0,0.0,4.0,-0.4019,0.2023,[]
3392,World,Valerie Hopkins,"In Lviv, New Russian Strikes Pierce the Sense of Security in West",Residents in the western city of Lviv once ignored the air raid sirens. But Russian rocket attacks over the weekend have brought the war closer to their doorstep.,all,8.0,2022-03-27 21:28:00+00:00,News,0,721.0,30.0,2.0,"lviv, new russian strikes pierce sense security west",residents western city lviv ignored air raid sirens. russian rocket attacks weekend brought war closer doorstep.,-0.0040672603,-0.0005410425,12,28,9,1,2,0,0,0,0,1,0,5,"['Lviv', 'New Russian Strikes Pierce']","['GPE', 'ORG']",2,1.0,0.0,0.0,0.0,0.0,6.0,-0.0258,-0.8968,['Lviv']
3515,Sports,Tyler Kepner,"For Albert Pujols, One Last Run Where It All Began","After 11 seasons away, Pujols, 42, returns to the St. Louis Cardinals. “Oh, he’s got something left,” said his new manager.",all,14.0,2022-03-28 23:10:27+00:00,News,0,720.0,20.0,2.0,"albert pujols, one last run began","11 seasons away, pujols, 42, returns st. louis cardinals. “oh, he’s got something left,” said new manager.",-0.0120274145,-0.018301163,10,21,10,1,8,0,0,0,0,1,0,1,"['Albert Pujols', 'One']","['PERSON', 'CARDINAL']",2,0.0,1.0,0.0,0.0,0.0,0.0,0.0,0.0,[]
2784,New York,Ashley Wong and Ashley Southall,Woman Is Charged in Shoving Death of Broadway Singing Coach,"Lauren Pazienza, 26, turned herself in and was charged with manslaughter in the death of Barbara Maier Gustern, 87.",all,16.0,2022-03-22 18:10:53+00:00,News,0,79.0,13.0,2.0,woman charged shoving death broadway singing coach,"lauren pazienza, 26, turned charged manslaughter death barbara maier gustern, 87.",-0.005646727,-0.008079466,10,19,8,0,4,0,0,0,0,1,0,6,[],[],0,0.0,0.0,0.0,0.0,0.0,1.0,-0.6908,-0.6908,[]
3350,Sports,Alanis Thames,N.C.A.A. Tournament: What to Watch as the Final Four Is Determined,There are two spots left for the final weekend of the men’s tournament.,all,0.0,2022-03-27 04:01:08+00:00,News,0,14.0,20.0,2.0,n.c.a.a. tournament: watch final four determined,two spots left final weekend men’s tournament.,-0.003128448,-0.012193961,11,13,11,5,1,0,0,0,0,1,0,1,[],[],0,0.0,0.0,0.0,0.0,0.0,6.0,0.34,0.0,[]
1305,Arts,Javier C. Hernández,Geffen Hall’s $550 Million Makeover Is Fully Funded,"The New York Philharmonic’s home will reopen in October, a year and a half ahead of schedule, after construction was accelerated during the pandemic.",all,6.0,2022-03-09 17:00:11+00:00,News,0,330.0,0.0,2.0,geffen hall’s $550 million makeover fully funded,"new york philharmonic’s home reopen october, year half ahead schedule, construction accelerated pandemic.",0.010525229,0.0021041878,8,24,7,1,3,0,0,0,0,1,0,1,"['Geffen Hall’s', '$550 Million']","['ORG', 'MONEY']",2,0.0,0.0,1.0,0.0,0.0,2.0,0.0,0.0,[]
552,U.S.,Azi Paybarah,Mother of Children Killed by Their Father Said She Lived in Fear,"The woman obtained a restraining order in 2021 after telling a California court, “He has not killed me because he would not know where to go with the children.”",all,0.0,2022-03-03 03:02:18+00:00,News,0,85.0,28.0,2.0,mother children killed father said lived fear,"woman obtained restraining order 2021 telling california court, “he killed would know go children.”",-0.023526138,-0.010470629,12,29,9,0,2,0,0,0,0,1,0,6,[],[],0,0.0,0.0,0.0,0.0,0.0,3.0,-0.8271,0.5559,[]
779,World,Steven Erlanger and Lara Jakes,"NATO rejects intervening in Ukraine, including with a no-fly zone.","The alliance will not engage Russian forces in the air or on the ground in Ukraine to avoid the risk of a wider European war, the secretary-general says.",all,0.0,2022-03-04 15:47:58+00:00,News,0,681.0,30.0,2.0,"nato rejects intervening ukraine, including no-fly zone.","alliance engage russian forces air ground ukraine avoid risk wider european war, secretary-general says.",0.0015103642,0.00080428284,10,28,5,3,3,0,0,0,0,1,0,5,"['NATO', 'Ukraine']","['ORG', 'GPE']",2,0.0,0.0,1.0,0.0,0.0,4.0,-0.4939,-0.8495,['Ukraine']
2736,Style,Guy Trebay,Willy Chavarria Represents,"With a powerful new collection, the queer Latinx designer muscles his way into the history of American fashion.",all,5.0,2022-03-22 09:00:26+00:00,News,0,282.0,21.0,2.0,willy chavarria represents,"powerful new collection, queer latinx designer muscles way history american fashion.",-0.008214022,-0.012282791,3,18,3,0,2,0,0,0,0,1,0,2,['Willy Chavarria Represents'],['PERSON'],1,0.0,1.0,0.0,0.0,0.0,1.0,0.0,0.4215,[]
3608,Books,Dwight Garner,"In Jennifer Egan’s New Novel, Our Memories Are Available for All to See","Egan’s “The Candy House,” a sequel to her Pulitzer Prize-winning “A Visit From the Goon Squad,” comes alive in dozens of entwined stories.",all,1.0,2022-03-29 17:05:07+00:00,Review,0,211.0,1.0,6.0,"jennifer egan’s new novel, memories available see","egan’s “the candy house,” sequel pulitzer prize-winning “a visit goon squad,” comes alive dozens entwined stories.",-0.008026462,-0.010649737,13,23,11,1,4,0,0,0,0,1,0,1,['Jennifer Egan’s'],['PERSON'],1,0.0,1.0,0.0,0.0,0.0,1.0,0.3182,0.3818,[]
3022,Sports,Sopan Deb,"Basketball Skills Got Him to the N.B.A., but Activism Made His Name",Enes Kanter Freedom has condemned human rights abuses in Turkey for years. Now he claims the N.B.A. is blackballing him as he focuses on abuses in China.,all,32.0,2022-03-24 09:00:38+00:00,News,0,671.0,20.0,2.0,"basketball skills got n.b.a., activism made name",enes kanter freedom condemned human rights abuses turkey years. claims n.b.a. blackballing focuses abuses china.,-0.013047468,-0.00013976017,12,27,11,4,5,0,0,0,0,1,0,1,[],[],0,0.0,0.0,0.0,0.0,0.0,3.0,0.0,-0.7096,[]
3078,World,Abdi Latif Dahir and Simon Marks,Ethiopia Declares ‘Humanitarian Truce’ in War-Ravaged Tigray Region,"The conflict, now lasting 17 months, has left thousands dead, millions displaced and hindered aid from reaching those going hungry in the country’s northern region.",all,5.0,2022-03-24 16:41:52+00:00,News,0,3.0,30.0,2.0,ethiopia declares ‘humanitarian truce’ war-ravaged tigray region,"conflict, lasting 17 months, left thousands dead, millions displaced hindered aid reaching going hungry country’s northern region.",-0.00089870614,-0.004686484,8,25,8,1,4,0,0,0,0,1,0,5,"['Ethiopia Declares ‘Humanitarian Truce', 'War-Ravaged Tigray Region']","['ORG', 'EVENT']",2,0.0,0.0,1.0,0.0,0.0,3.0,0.0,-0.7003,[]
545,U.S.,"Zolan Kanno-Youngs, Jonathan Weisman and Emily Cochrane","As Biden Pivots, Democrats Seek to Salvage His Domestic Agenda","The president repackaged his sweeping domestic policy plan with more centrist language, but it remained unclear whether Congress would resurrect key elements of his agenda.",all,15.0,2022-03-03 01:13:36+00:00,News,0,744.0,28.0,2.0,"biden pivots, democrats seek salvage domestic agenda","president repackaged sweeping domestic policy plan centrist language, remained unclear whether congress would resurrect key elements agenda.",-0.0034670027,-0.00047557792,10,25,9,1,2,0,0,0,0,2,1,6,"['Biden Pivots', 'Democrats']","['PERSON', 'NORP']",2,0.0,1.0,0.0,0.0,0.0,3.0,0.0,-0.3612,[]
2032,World,"David E. Sanger, Steven Erlanger and Glenn Thrush",Biden will travel to Europe next week for an extraordinary NATO meeting.,"The president will travel to Brussels for the NATO session, and will also attend a European Union summit meeting.",all,0.0,2022-03-15 18:12:04+00:00,News,0,193.0,30.0,2.0,biden travel europe next week extraordinary nato meeting.,"president travel brussels nato session, also attend european union summit meeting.",0.0018993838,0.00015007655,12,19,6,1,2,0,0,0,0,2,1,5,"['Biden', 'Europe', 'next week', 'NATO']","['PERSON', 'LOC', 'DATE', 'ORG']",4,0.0,1.0,0.0,0.0,0.0,1.0,0.0,0.0,[]
