,section,byline,title,abstract,class,print_page,pub_date,type_of_material,class_le,byline_le,section_le,type_of_material_le,title_clean,abstract_clean,title_vec_avg,abstract_vec_avg,title_len,abstract_len,capital_letters,title_punct_num,abstract_punct_num,title_!,abstract_!,title_?,abstract_?,authors_num,coauthors,sections_grouped,title_ner,title_ner_type,ners_num,ner_GPE,ner_PERSON,ner_ORG,ner_MONEY,ner_NORP,pub_day_of_week,title_sentiment,abstract_sentiment,countries
2177,Sports,David W. Chen,Joe Buck and Troy Aikman to Host ‘Monday Night Football’,"Their multiyear deals will make the duo, who have called games together for 20 N.F.L. seasons, among the highest-paid sports broadcasters.",all,12.0,2022-03-16 22:13:02+00:00,News,0,202.0,20.0,2.0,joe buck troy aikman host ‘monday night football’,"multiyear deals make duo, called games together 20 n.f.l. seasons, among highest-paid sports broadcasters.",-0.011605616,0.0059702126,10,21,8,0,7,0,0,0,0,1,0,1,"['Joe Buck', 'Troy Aikman', 'Monday Night Football’']","['PERSON', 'PERSON', 'WORK_OF_ART']",3,0.0,1.0,0.0,0.0,0.0,2.0,0.0,0.0,[]
1204,World,Megan Specia,Ukrainians Trying to Flee to U.K. Face a Confounding Path,The government has offered a way for U.K. residents to bring over Ukrainian relatives fleeing the war. But families and rights groups say it’s a bureaucratic nightmare that makes it too difficult to get in.,all,7.0,2022-03-08 21:46:33+00:00,News,0,516.0,30.0,2.0,ukrainians trying flee u.k. face confounding path,government offered way u.k. residents bring ukrainian relatives fleeing war. families rights groups say it’s bureaucratic nightmare makes difficult get in.,0.0010153204,-0.0036928407,10,35,8,2,4,0,0,0,0,1,0,5,"['Ukrainians', 'U.K. Face a Confounding Path']","['NORP', 'ORG']",2,0.0,0.0,0.0,0.0,1.0,1.0,0.0,-0.6908,[]
3256,Arts,Robin Pogrebin,"Amid Opposition, Laurie Cumbo Named New York City’s Culture Czar","Cumbo, who was appointed commissioner of the Department of Cultural Affairs by Mayor Eric Adams, has a background in the arts, and a history of controversial statements.",all,1.0,2022-03-25 19:29:31+00:00,News,0,619.0,0.0,2.0,"amid opposition, laurie cumbo named new york city’s culture czar","cumbo, appointed commissioner department cultural affairs mayor eric adams, background arts, history controversial statements.",-0.007411275,-0.009574169,10,27,10,1,4,0,0,0,0,1,0,1,"['Amid Opposition', 'Laurie Cumbo', 'New York City’s']","['ORG', 'PERSON', 'GPE']",3,0.0,0.0,1.0,0.0,0.0,4.0,0.0,-0.2023,['New York City’s']
3476,U.S.,Michael Crowley,Would Putin Strike NATO Supply Lines to Ukraine? History Suggests No.,"From the Soviets in Afghanistan to the U.S. in Korea, Moscow and Washington have often chosen not to attack the countries aiding their enemies.",all,12.0,2022-03-28 18:09:24+00:00,News,0,526.0,28.0,2.0,would putin strike nato supply lines ukraine? history suggests no.,"soviets afghanistan u.s. korea, moscow washington often chosen attack countries aiding enemies.",-0.0053686285,-0.003314972,11,24,13,2,4,0,0,1,0,1,0,6,"['Putin', 'NATO Supply Lines', 'Ukraine']","['PERSON', 'ORG', 'GPE']",3,0.0,1.0,0.0,0.0,0.0,0.0,-0.128,-0.1645,['Ukraine']
1865,World,Austin Ramzy,"A pregnant woman photographed after a Russian strike on a maternity hospital has died, The A.P. reports.","Her baby also died, the news organization said. The photo captured last week has become one of the defining images of human suffering in the war.",all,10.0,2022-03-14 13:07:12+00:00,News,0,83.0,30.0,2.0,"pregnant woman photographed russian strike maternity hospital died, a.p. reports.","baby also died, news organization said. photo captured last week become one defining images human suffering war.",-0.009206357,-0.0135627035,17,26,5,4,3,0,0,0,0,1,0,5,"['Russian', 'A.P.']","['NORP', 'ORG']",2,0.0,0.0,0.0,0.0,1.0,0.0,-0.6249,-0.891,[]
1907,U.S.,Anushka Patil and Annie Karni,"At least four House Democrats test positive after a party retreat, but it’s difficult to know where they were infected.",All four House members attributed their lack of severe symptoms to protection from vaccines.,all,0.0,2022-03-14 19:12:51+00:00,News,0,75.0,28.0,2.0,"least four house democrats test positive party retreat, it’s difficult know infected.",four house members attributed lack severe symptoms protection vaccines.,-0.008146114,-0.002050105,20,14,3,2,1,0,0,0,0,1,0,6,"['At least four', 'House', 'Democrats']","['CARDINAL', 'ORG', 'NORP']",3,0.0,0.0,0.0,0.0,0.0,0.0,-0.6124,-0.5994,[]
2932,Business Day,Neal E. Boudette,"Stellantis, maker of Chryslers and Jeeps, and LG will spend $4 billion on a new battery factory in Ontario.","The automaker, which was created by the merger of Fiat Chrysler and Peugeot, has lagged in the fast-growing market for electric cars.",all,0.0,2022-03-23 18:58:32+00:00,News,0,560.0,4.0,2.0,"stellantis, maker chryslers jeeps, lg spend $4 billion new battery factory ontario.","automaker, created merger fiat chrysler peugeot, lagged fast-growing market electric cars.",3.722628e-05,0.0029744538,19,22,6,4,4,0,0,0,0,1,0,4,"['Stellantis', 'Chryslers', 'Jeeps', 'LG', '$4 billion', 'Ontario']","['ORG', 'PRODUCT', 'PRODUCT', 'ORG', 'MONEY', 'GPE']",6,0.0,0.0,1.0,0.0,0.0,2.0,0.0,-0.0516,['Ontario']
918,Crosswords & Games,Caitlin Lovinger,Parlor Trick,Matthew Stock and Will Nediger practice their crossword wizardry on us.,all,0.0,2022-03-05 23:00:06+00:00,News,0,116.0,6.0,2.0,parlor trick,matthew stock nediger practice crossword wizardry us.,-0.023825996,-0.009591332,2,11,2,0,1,0,0,0,0,1,0,1,['Parlor Trick'],['ORG'],1,0.0,0.0,1.0,0.0,0.0,5.0,-0.0516,0.0,[]
1713,New York,Ashley Wong,Booster shot data from New York City shows major disparities by race and neighborhood.,"The data showed that only about 36 percent of city residents had received a booster shot, and the numbers varied significantly by neighborhood and race.",all,0.0,2022-03-12 14:22:45+00:00,News,0,78.0,13.0,2.0,booster shot data new york city shows major disparities race neighborhood.,"data showed 36 percent city residents received booster shot, numbers varied significantly neighborhood race.",-0.0012537952,0.0034040532,14,25,4,1,2,0,0,0,0,1,0,6,['New York City'],['GPE'],1,1.0,0.0,0.0,0.0,0.0,5.0,0.0,0.0,['New York City']
2457,World,Chris Buckley,Defying China’s Censors to Urge Beijing to Denounce Russia’s War,"A persistent minority of Chinese scholars, journalists and citizens is warning Beijing against the risks of supporting the invasion of Ukraine.",all,1.0,2022-03-18 19:46:50+00:00,News,0,145.0,30.0,2.0,defying china’s censors urge beijing denounce russia’s war,"persistent minority chinese scholars, journalists citizens warning beijing risks supporting invasion ukraine.",-0.003652618,-0.003876721,10,21,8,0,2,0,0,0,0,1,0,5,"['Urge Beijing', 'Russia']","['GPE', 'GPE']",2,1.0,0.0,0.0,0.0,0.0,4.0,-0.8176,-0.1531,"['Urge Beijing', 'Russia']"
3089,World,Marc Santora,How One Month of War in Ukraine Ground to a Bloody Stalemate,"In four weeks, huge numbers of civilians have been bombed and displaced, but Russia has so far achieved almost none of its military objectives, analysts say.",all,14.0,2022-03-24 17:39:29+00:00,News,0,476.0,30.0,2.0,one month war ukraine ground bloody stalemate,"four weeks, huge numbers civilians bombed displaced, russia far achieved almost none military objectives, analysts say.",-0.005742945,-0.0043906635,12,26,8,0,4,0,0,0,0,1,0,5,"['One Month of War', 'Ukraine Ground']","['DATE', 'ORG']",2,0.0,0.0,0.0,0.0,0.0,3.0,-0.7783,0.1655,[]
3387,Climate,"Christopher Flavelle, Julie Tate and Erin Schaff","How Joe Manchin Aided Coal, and Earned Millions","At every step of his political career, Joe Manchin helped a West Virginia power plant that is the sole customer of his private coal business. Along the way, he blocked ambitious climate action.",all,1.0,2022-03-27 20:37:26+00:00,News,0,154.0,5.0,2.0,"joe manchin aided coal, earned millions","every step political career, joe manchin helped west virginia power plant sole customer private coal business. along way, blocked ambitious climate action.",0.000169727,-0.003769842,8,33,7,1,4,0,0,0,0,2,1,3,"['Joe Manchin', 'Millions']","['PERSON', 'CARDINAL']",2,0.0,1.0,0.0,0.0,0.0,6.0,0.0,0.25,[]
2972,U.S.,Glenn Thrush,Republicans have requested presentence reports on some of Jackson’s cases.,"Such reports typically contain personal information about a defendant, and might include sensitive details about their relationships, including victims.",all,0.0,2022-03-23 23:12:05+00:00,News,0,274.0,28.0,2.0,republicans requested presentence reports jackson’s cases.,"reports typically contain personal information defendant, might include sensitive details relationships, including victims.",-0.0011250956,0.00147413,10,19,2,1,3,0,0,0,0,1,0,6,"['Republicans', 'Jackson']","['NORP', 'PERSON']",2,0.0,0.0,0.0,0.0,1.0,2.0,0.0,-0.3182,[]
3233,Opinion,New York Times Opinion,Did You Lose a Loved One to Covid?,"Two years into the pandemic, almost one million Americans have died of Covid. Would you help us memorialize their passing?",all,0.0,2022-03-25 16:17:00+00:00,Op-Ed,0,565.0,15.0,5.0,lose loved one covid?,"two years pandemic, almost one million americans died covid. would help us memorialize passing?",-0.020643814,-0.004120907,8,20,6,1,3,0,0,1,1,1,0,7,['Covid'],['GPE'],1,1.0,0.0,0.0,0.0,0.0,4.0,0.296,-0.2263,['Covid']
1744,World,Daniel Walters,"Oregon and Washington State, known for cautious Covid strategies, lift their statewide mask mandates.","Oregon and Washington State, two of the most successful states at limiting deaths and infections during the pandemic, lifted their statewide mask mandates on Saturday, making masks optional in most settings.",all,0.0,2022-03-12 23:57:35+00:00,News,0,177.0,30.0,2.0,"oregon washington state, known cautious covid strategies, lift statewide mask mandates.","oregon washington state, two successful states limiting deaths infections pandemic, lifted statewide mask mandates saturday, making masks optional settings.",-0.0021808923,0.001753403,14,31,4,3,4,0,0,0,0,1,0,5,"['Oregon', 'Washington State']","['GPE', 'GPE']",2,1.0,0.0,0.0,0.0,0.0,5.0,-0.1027,0.624,"['Oregon', 'Washington State']"
564,Sports,David Waldstein and Amy Chang Chien,"In Reversal, Paralympics Bars Athletes From Russia and Belarus","Paralympics organizers citied athlete discontent, boycott threats and a fear of violence in ejecting the athletes on the eve of the opening ceremony.",all,7.0,2022-03-03 08:22:45+00:00,News,0,204.0,20.0,2.0,"reversal, paralympics bars athletes russia belarus","paralympics organizers citied athlete discontent, boycott threats fear violence ejecting athletes eve opening ceremony.",-0.0054575955,-0.008561055,9,23,8,1,2,0,0,0,0,1,0,1,"['Reversal', 'Paralympics Bars Athletes', 'Russia', 'Belarus']","['GPE', 'ORG', 'GPE', 'GPE']",4,1.0,0.0,0.0,0.0,0.0,3.0,0.0,-0.9081,"['Reversal', 'Russia', 'Belarus']"
2007,U.S.,Derrick Bryson Taylor,"Scott Hall, Wrestler Who Rose to Fame as Razor Ramon, Dies at 63","Called a “hugely influential superstar” by World Wrestling Entertainment, he was also a founding member of the villainous New World Order with Kevin Nash and Hulk Hogan.",all,12.0,2022-03-15 13:19:42+00:00,Obituary (Obit),0,209.0,28.0,4.0,"scott hall, wrestler rose fame razor ramon, dies 63","called “hugely influential superstar” world wrestling entertainment, also founding member villainous new world order kevin nash hulk hogan.",-0.013022992,-0.015866634,13,27,9,2,2,0,0,0,0,1,0,6,"['Scott Hall', 'Rose', 'Fame', 'Razor Ramon', '63']","['PERSON', 'PERSON', 'ORG', 'PERSON', 'CARDINAL']",5,0.0,1.0,0.0,0.0,0.0,1.0,0.4404,0.4019,[]
2928,U.S.,Jonathan Weisman,Graham takes a caustic tone in questioning Jackson.,"The Republican Senator, a one-time supporter of Judge Jackson, has been among her most aggressive questioners.",all,0.0,2022-03-23 18:09:46+00:00,News,0,375.0,28.0,2.0,graham takes caustic tone questioning jackson.,"republican senator, one-time supporter judge jackson, among aggressive questioners.",-0.024676431,-0.008599412,8,16,2,1,4,0,0,0,0,1,0,6,"['Graham', 'Jackson']","['PERSON', 'PERSON']",2,0.0,1.0,0.0,0.0,0.0,2.0,-0.1027,0.0534,[]
2292,Travel,Ceylan Yeginsu,Canada eases its Covid rules for fully vaccinated travelers from abroad.,"Proof of a recent negative test result will no longer be required, though some travelers may still be chosen at random to be tested on arrival.",all,0.0,2022-03-17 17:55:10+00:00,News,0,137.0,27.0,2.0,canada eases covid rules fully vaccinated travelers abroad.,"proof recent negative test result longer required, though travelers may still chosen random tested arrival.",0.006631036,-0.0015220501,11,26,2,1,2,0,0,0,0,1,0,2,"['Canada', 'Covid']","['GPE', 'FAC']",2,1.0,0.0,0.0,0.0,0.0,3.0,0.3182,-0.7096,['Canada']
652,Sports,Matthew Futterman,A Covid Ruling Opens the French Open Door to Novak Djokovic,"With France set to end its vaccine requirements later this month, the unvaccinated Serbian champion appears poised to defend his title at Roland Garros.",all,10.0,2022-03-03 19:17:47+00:00,News,0,506.0,20.0,2.0,covid ruling opens french open door novak djokovic,"france set end vaccine requirements later month, unvaccinated serbian champion appears poised defend title roland garros.",-0.009533744,-3.1117994e-05,11,24,9,0,2,0,0,0,0,1,0,1,['Novak Djokovic'],['PERSON'],1,0.0,1.0,0.0,0.0,0.0,3.0,0.0,0.7096,[]
3398,Style,Guy Trebay,Nicole Kidman and Sophia Loren at Armani Pre-Oscars Party,"And a parade of stars, including Kristen Stewart and Joan Collins, at Chanel dinner.",all,0.0,2022-03-27 23:13:58+00:00,News,0,282.0,21.0,2.0,nicole kidman sophia loren armani pre-oscars party,"parade stars, including kristen stewart joan collins, chanel dinner.",-0.004229564,-0.0026096543,9,14,8,1,3,0,0,0,0,1,0,2,"['Nicole Kidman', 'Sophia Loren', 'Armani Pre-Oscars Party']","['PERSON', 'PERSON', 'PERSON']",3,0.0,1.0,0.0,0.0,0.0,6.0,0.4019,0.0,[]
880,Arts,Amanda Hess,Hollywood Bets Big on the Bad Entrepreneur,"With limited series like “The Dropout,” “WeCrashed” and “Super Pumped,” the culture is saturated with ripped-from-the-headlines tales of self-immolating moguls.",all,1.0,2022-03-05 10:00:16+00:00,News,0,41.0,0.0,2.0,hollywood bets big bad entrepreneur,"limited series like “the dropout,” “wecrashed” “super pumped,” culture saturated ripped-from-the-headlines tales self-immolating moguls.",-0.00787639,-0.011207128,7,20,5,0,7,0,0,0,0,1,0,1,['Hollywood Bets Big'],['ORG'],1,0.0,0.0,1.0,0.0,0.0,5.0,-0.5423,0.1531,[]
2343,U.S.,Blake Hounshell and Leah Askarinam,Climate Activists Flex Their Political Muscle,Environmental groups want Democrats to confront oil companies over high gas prices. And Democrats are listening.,all,0.0,2022-03-17 23:03:06+00:00,News,0,104.0,28.0,2.0,climate activists flex political muscle,environmental groups want democrats confront oil companies high gas prices. democrats listening.,-0.003462851,-0.009346161,6,16,6,0,2,0,0,0,0,1,0,6,[],[],0,0.0,0.0,0.0,0.0,0.0,3.0,0.0,-0.1027,[]
3650,U.S.,Charlie Savage,Why a Ruling Declaring Trump ‘Likely’ Broke Laws May Not Mean He Will Be Prosecuted,A high-profile ruling about a subpoena from the House committee investigating the Jan. 6 attack turned on a lower standard of proof than a criminal trial.,all,20.0,2022-03-29 23:44:51+00:00,News,0,142.0,28.0,2.0,ruling declaring trump ‘likely’ broke laws may mean prosecuted,high-profile ruling subpoena house committee investigating jan. 6 attack turned lower standard proof criminal trial.,-0.008570317,0.003555972,15,26,14,0,3,0,0,0,0,1,0,6,[],[],0,0.0,0.0,0.0,0.0,0.0,1.0,-0.6597,-0.8271,[]
1820,Movies,Laura Zornosa,"Maria Bakalova, Billy Crystal and other stars show support for Ukraine.","Most of the Critics Choice ceremony has been focused on prizes, but the war in Ukraine has been addressed in a few ways.",all,0.0,2022-03-14 00:39:15+00:00,News,0,429.0,12.0,2.0,"maria bakalova, billy crystal stars show support ukraine.","critics choice ceremony focused prizes, war ukraine addressed ways.",-0.010510697,-0.0014281601,11,23,5,2,2,0,0,0,0,1,0,1,"['Maria Bakalova', 'Billy Crystal', 'Ukraine']","['PERSON', 'PERSON', 'GPE']",3,0.0,1.0,0.0,0.0,0.0,0.0,0.4019,-0.6465,['Ukraine']
1727,Health,Paula Span,Meet the Underdog of Senior Care,"The Program of All-Inclusive Care for the Elderly, funded by Medicare and Medicaid, has quietly succeeded in enabling some older Americans to age in place.",all,7.0,2022-03-12 17:06:36+00:00,News,0,593.0,10.0,2.0,meet underdog senior care,"program all-inclusive care elderly, funded medicare medicaid, quietly succeeded enabling older americans age place.",-0.024766225,-0.0006228115,6,25,4,0,4,0,0,0,0,1,0,2,[],[],0,0.0,0.0,0.0,0.0,0.0,5.0,0.4939,0.7184,[]
2215,U.S.,Maya King,Why Stacey Abrams Isn’t Embracing Her Democratic Stardom (So Far),"On the campaign trail for Georgia governor, she is talking more about Medicaid expansion than voting rights, betting that a hyperlocal strategy and the state’s leftward tilt can lift her to victory.",all,14.0,2022-03-17 09:00:13+00:00,News,0,512.0,28.0,2.0,stacey abrams isn’t embracing democratic stardom (so far),"campaign trail georgia governor, talking medicaid expansion voting rights, betting hyperlocal strategy state’s leftward tilt lift victory.",-0.0067372606,0.0032179204,10,32,10,2,3,0,0,0,0,1,0,6,['Stacey Abrams'],['PERSON'],1,0.0,1.0,0.0,0.0,0.0,3.0,0.0,0.0,[]
3211,Movies,Ben Kenigsberg,Peter Bogdanovich Had a Vision for This Film. Now It’s Finally Being Seen.,"“She’s Funny That Way” wasn’t exactly the movie he set out to make, but the director’s cut was feared lost. How it came to be shown at MoMA is a complicated saga.",all,3.0,2022-03-25 14:00:07+00:00,News,0,92.0,12.0,2.0,peter bogdanovich vision film. it’s finally seen.,"“she’s funny way” wasn’t exactly movie set make, director’s cut feared lost. came shown moma complicated saga.",-0.013046242,-0.01571853,13,32,11,2,3,0,0,0,0,1,0,1,['Peter Bogdanovich'],['PERSON'],1,0.0,1.0,0.0,0.0,0.0,4.0,0.25,-0.8381,[]
331,Business Day,Katie Robertson,Journalists at Gizmodo and related websites go on strike.,The contract between about 100 workers at six publications and G/O Media expired on Monday night.,all,0.0,2022-03-01 18:36:42+00:00,News,0,406.0,4.0,2.0,journalists gizmodo related websites go strike.,contract 100 workers six publications g/o media expired monday night.,-0.009532252,-0.0008337164,9,16,2,1,2,0,0,0,0,1,0,4,[],[],0,0.0,0.0,0.0,0.0,0.0,1.0,-0.128,0.0,[]
2132,Sports,Benjamin Hoffman,"Yankees’ Infield Is Complete, but Comes With Questions","By bringing back first baseman Anthony Rizzo, the Yankees have a solid player at each infield position. But they also passed on all of the top-tier free agents.",all,0.0,2022-03-16 14:53:32+00:00,News,0,97.0,20.0,2.0,"yankees’ infield complete, comes questions","bringing back first baseman anthony rizzo, yankees solid player infield position. also passed top-tier free agents.",-0.011660333,-0.0025047502,8,28,7,1,4,0,0,0,0,1,0,1,['Yankees'],['ORG'],1,0.0,0.0,1.0,0.0,0.0,2.0,0.0,0.6956,[]
388,Business Day,Niraj Chokshi and Neal E. Boudette,Boeing and Ford suspend operations in Russia.,The U.S. manufacturing companies are the latest to shut down offices and factories since Russia invaded Ukraine.,all,0.0,2022-03-02 01:38:57+00:00,News,0,578.0,4.0,2.0,boeing ford suspend operations russia.,u.s. manufacturing companies latest shut offices factories since russia invaded ukraine.,-0.00049979327,-0.0043824245,7,17,3,1,3,0,0,0,0,1,0,4,"['Boeing', 'Ford', 'Russia']","['ORG', 'ORG', 'GPE']",3,0.0,0.0,1.0,0.0,0.0,2.0,-0.3182,0.0,['Russia']
1473,Food,Eric Asimov,12 Wines From Argentina and Chile to Seek Out,These distinctive wines show off the character and identity of South American terroirs.,all,6.0,2022-03-10 19:52:38+00:00,News,0,242.0,8.0,2.0,12 wines argentina chile seek,distinctive wines show character identity south american terroirs.,0.01741982,0.011710966,9,13,6,0,1,0,0,0,0,1,0,2,"['12', 'Argentina', 'Chile']","['CARDINAL', 'GPE', 'GPE']",3,0.0,0.0,0.0,0.0,0.0,3.0,0.0,0.0,"['Argentina', 'Chile']"
3091,The Learning Network,The Learning Network,Film Club: ‘Yaren and the Sun’,This short film tells the story of a camp for kids who have lost someone important. How do you deal with grief?,all,0.0,2022-03-24 17:41:15+00:00,News,0,695.0,24.0,2.0,film club: ‘yaren sun’,short film tells story camp kids lost someone important. deal grief?,-0.023829581,-0.012930559,6,22,4,1,2,0,0,0,1,1,0,7,"['Yaren', 'Sun']","['PERSON', 'ORG']",2,0.0,1.0,0.0,0.0,0.0,3.0,0.0,-0.5719,[]
3684,Arts,Noel Murray,Curious About ‘Moon Knight’? Here’s What You Need to Know.,"Starring Oscar Isaac and Ethan Hawke, the new Marvel series follows a troubled, crime-fighting caped crusader. But don’t mistake him for Batman.",all,0.0,2022-03-30 09:00:33+00:00,News,0,580.0,0.0,2.0,curious ‘moon knight’? here’s need know.,"starring oscar isaac ethan hawke, new marvel series follows troubled, crime-fighting caped crusader. don’t mistake batman.",-0.016902907,-0.005680473,10,22,9,2,5,0,0,1,0,1,0,1,[],[],0,0.0,0.0,0.0,0.0,0.0,2.0,0.3182,-0.4939,[]
2728,Books,Alida Becker,Hard Times: Novels That Explore Old Conflicts,"New books whisk readers back to the Civil War, World War II and medieval times.",all,9.0,2022-03-22 09:00:08+00:00,Review,0,32.0,1.0,6.0,hard times: novels explore old conflicts,"new books whisk readers back civil war, world war ii medieval times.",0.0007566873,-0.008251939,7,15,7,1,2,0,0,0,0,1,0,1,[],[],0,0.0,0.0,0.0,0.0,0.0,1.0,-0.4588,-0.8316,[]
2639,Food,Eric Asimov,10 Grapes Worth Knowing Better,"For many reasons, these varieties have either been unfairly dismissed or are little known outside their home regions. But they make joyful wines.",all,7.0,2022-03-21 14:29:42+00:00,News,0,242.0,8.0,2.0,10 grapes worth knowing better,"many reasons, varieties either unfairly dismissed little known outside home regions. make joyful wines.",0.00021680872,-0.0024900993,5,23,4,0,3,0,0,0,0,1,0,2,['10'],['CARDINAL'],1,0.0,0.0,0.0,0.0,0.0,0.0,0.5859,0.7469,[]
2578,Briefing,Matthew Cullen,Your Monday Briefing: Russia’s Assault on Mariupol,Plus China’s new Covid strategy and concerns of world hunger.,all,0.0,2022-03-20 20:59:22+00:00,briefing,0,505.0,2.0,7.0,monday briefing: russia’s assault mariupol,plus china’s new covid strategy concerns world hunger.,-0.00052600226,-0.003059674,7,10,6,1,1,0,0,0,0,1,0,4,"['Monday', 'Russia', 'Mariupol']","['DATE', 'GPE', 'ORG']",3,0.0,0.0,0.0,0.0,0.0,6.0,-0.5859,-0.25,['Russia']
1822,New York,Jan Ransom,"Broadway Singing Coach, 87, Dies After Attack on Street",Barbara Maier Gustern was pushed to the ground outside her Manhattan apartment building by a woman who remains at large.,all,0.0,2022-03-14 01:19:24+00:00,News,0,321.0,13.0,2.0,"broadway singing coach, 87, dies attack street",barbara maier gustern pushed ground outside manhattan apartment building woman remains large.,-0.005744816,-0.0077866483,9,20,7,2,1,0,0,0,0,1,0,6,"['Broadway Singing Coach', '87']","['ORG', 'DATE']",2,0.0,0.0,1.0,0.0,0.0,0.0,-0.4767,0.0,[]
2860,Business Day,Gillian Friedman and Emma Goldberg,The Pandemic Wrecked Millions of Careers. These 6 People Built New Ones.,"For some, the Covid-19 crisis presented an opportunity to change course. For each, it was a big risk on a new future.",all,4.0,2022-03-23 09:00:32+00:00,News,0,272.0,4.0,2.0,pandemic wrecked millions careers. 6 people built new ones.,"some, covid-19 crisis presented opportunity change course. each, big risk new future.",-0.003698778,-0.0035230713,12,22,10,2,5,0,0,0,0,1,0,4,['6'],['CARDINAL'],1,0.0,0.0,0.0,0.0,0.0,2.0,0.0,-0.5267,[]
907,Arts,Richard Sandomir,"Tony Walton, Award-Winning Stage and Screen Designer, Dies at 87","He worked with the directors Mike Nichols, Bob Fosse and Jerry Zaks, winning three Tony Awards and an Oscar for “All That Jazz.”",all,18.0,2022-03-05 19:15:35+00:00,Obituary (Obit),0,612.0,0.0,4.0,"tony walton, award-winning stage screen designer, dies 87","worked directors mike nichols, bob fosse jerry zaks, winning three tony awards oscar “all jazz.”",0.0071305004,-0.006780939,10,23,8,3,3,0,0,0,0,1,0,1,"['Tony Walton', '87']","['PERSON', 'CARDINAL']",2,0.0,1.0,0.0,0.0,0.0,5.0,0.0,0.7506,[]
900,Opinion,Jane Coaston,Putin’s Fear of Free Speech Speaks Volumes,What we are seeing in Russia is a reminder of why protecting free speech is so important.,all,0.0,2022-03-05 16:00:04+00:00,Op-Ed,0,323.0,15.0,5.0,putin’s fear free speech speaks volumes,seeing russia reminder protecting free speech important.,-0.007096474,-0.0006399143,7,17,6,0,1,0,0,0,0,1,0,7,['Putin'],['PERSON'],1,0.0,1.0,0.0,0.0,0.0,5.0,0.0258,0.6875,[]
2267,Movies,Kyle Buchanan,"A ‘Lost City’ Group Chat With Sandra Bullock, Channing Tatum and Daniel Radcliffe","Their movie comedy will be under close scrutiny at the box office. But they aren’t fazed and have lots to say about that Brad Pitt cameo, “Magic Mike” and “Harry Potter.”",all,8.0,2022-03-17 14:00:14+00:00,News,0,423.0,12.0,2.0,"‘lost city’ group chat sandra bullock, channing tatum daniel radcliffe","movie comedy close scrutiny box office. aren’t fazed lots say brad pitt cameo, “magic mike” “harry potter.”",-0.022397801,-0.016931584,13,31,12,1,3,0,0,0,0,1,0,1,"['Sandra Bullock', 'Channing Tatum', 'Daniel Radcliffe']","['PERSON', 'PERSON', 'PERSON']",3,0.0,1.0,0.0,0.0,0.0,3.0,0.0,0.1901,[]
